Enter the Term,beads craft,,,,
,,,,,
id,publish time,channel id,title,description,channel
870J4GbLDw8,2019-07-28T10:00:00Z,UCbP0hjFiW9CEnL9HpSPbK_Q,5 Brilliant Craft Ideas From beads | Home Decor | Artkala,5 DIY Ideas From beads | Home Decor | Artkala #beads #craft Subscribe for Free = http://bit.ly/2MpFkye DIY Craft lovers can also follow Artkala on ...,Artkala
oacPHUv7QHI,2019-07-20T10:45:36Z,UCnEpMhGQ1O_2-JK8w2FaSYQ,5 ИДЕЙ поделок ИЗ БИСЕРА своими руками,"В этом видео я собрала для Вас 5 мастер-классов из бисера и проволоки. Увидите, как легко и просто сделать интересные поделки и подарки из бисера ...",DIANA Bilohorka
wRGQydPlP5E,2014-07-20T08:00:03Z,UC8B2IELLIDNH7ki7ke6tXow,DIY: Cute Daisy Chain Bracelet ¦ The Corner of Craft,"Learn how to make this cute and simple daisy chain bracelet, using seed beads! Perfect for beginners! You'll also learn how to professionally finish off your ...",The Corner of Craft
l7QZWTtCk4E,2020-11-25T01:00:06Z,UCCNlEU60bIEYB-o3v8y2HDQ,How to make Mask Holder | Beaded Jewelry | Beads Craft | Fashion Jewelry |비즈 공예 |Beads Art |ビーズ DIY,Hi ! This video is how to make a beaded mask holder. Take good care of your health. Thanks for watching. New video will be uploaded next Wednesday.,pureag
PXBbR-ZaMnY,2019-03-05T16:15:19Z,UCk4Oqj6ZaAezWsSU76bzBLA,DIY 7 Beautiful beads designs/  Easy Beaded crafts for beginners @Homemade Creations - HMC,1 - Beads star . Link https://youtu.be/o2_TJq6NjrA 2 - Beaded ball. Link https://youtu.be/NXCCF-mOO1s 3 - Table Mat. Link https://youtu.be/rSHnwrpsC4k ...,Homemade Creations - HMC - by Vandana Hegde
LO-K_JeDyaI,2017-11-14T13:58:23Z,UC2EYvdgX-yhzSLCL6NY6iIw,How To Make Beaded Ball | Simple And Easy Pattern | Beads Ball | Soccer Ball | Beads Craft Ideas,You Can Do This (DIY Projects) : How To Make Beaded Ball | Simple And Easy Pattern | Beads Ball | Soccer Ball | Beads Craft Ideas Materials Required For ...,You can do this
-yJ8YB7tlTM,2021-09-24T21:58:43Z,UC5L0eW9v0x0vl_dt1n3Zghg,Things to make with beads (that are NOT jewelry!),"Products I used (affiliate links, see disclosure below) 8 mm pearl beads: https://amzn.to/3zzeufb 8 mm crystal beads: https://amzn.to/3ESqkEM 28 gauge wire: ...",Megan Weller
IQpXYpMJF9I,2017-08-22T06:12:09Z,UC2EYvdgX-yhzSLCL6NY6iIw,How To Make Crystal Beads Keychians At Home  | Beaded Keychains | Beads Craft Ideas,How To Make Crystal Beads Keychians At Home | Beaded Keychains | Beads Craft Ideas Materials Required For Making Crystal Beads Keychains : 1.Crystal ...,You can do this
KHMYMomaoAE,2020-03-24T19:00:31Z,UCfrnbBJ26qs4-5pwG4IFGww,HOW TO MAKE WOOD BEADS/SUPER CHEAP AND EASY CRAFT/FARMHOUSE HOME DECOR DIY/HOT HUMBLE PIE,"How to make wood beads cheap and easy for farmhouse DIY home decor, boho DIY home decor and every other look you enjoy! These little babies look and ...",Hot Humble Pie
Fm9MpxUjWeI,2020-10-19T13:49:35Z,UCuLsM_aXy5WrejCuQbxhVpg,Wings Media | Pen Holder | Bead Craft Ideas | DIY | Decoration and Gift Ideas,"Simple and Cute bead pen holder... Wings Media...Art and Craft Ideas with paint, bead, paper, stone and so on...",Wings Media
,2020-05-20T20:13:36Z,UCM3NwSKJo-jGX3VuU1OgoaA,Maria's Beads Craft,Beads Craft Tutorial Beads Accessories Tutorial.,Maria's Beads Craft
P5nhEz0XPog,2015-09-09T14:00:02Z,UC8B2IELLIDNH7ki7ke6tXow,DIY Tiny Seed Bead Crown ¦ The Corner of Craft,"Today Queen Elizabeth II becomes the longest reigning British Monarch, and I thought I would commemorate it by making this little seed bead crown! It pretty ...",The Corner of Craft
Q_ALHzL6NeI,2021-06-12T07:21:17Z,UCk4Oqj6ZaAezWsSU76bzBLA,Pearl Beaded Temple | DIY Easy Beads Temple making | Beaded Craft @Homemade Creations - HMC,beadscraft#beadedtemple#beadstemple# @Homemade Creations - HMC Please Watch the full video. Like and subscribe my channel. Also watch other beads ...,Homemade Creations - HMC - by Vandana Hegde
ZoqMF9W_dk0,2020-12-15T11:43:38Z,UCil7CXQB5rIAaJdcnd6SQyQ,Beaded Alphabet Keychain Letter A || Beads Craft Tutorial by AnythingEverythingZ,Beaded alphabet keychain letter A || Beads craft tutorial by AnythingEverythingZ You can learn how to make keychains in this video. tools needed. 1. beads 2.,AnythingEverythingZ
tnAeV18wqa0,2019-08-09T09:00:11Z,UC1aWZz7JnyZYd9ELsZd5Tdg,How to make Lamp beads  Craft gift Part 2 || Crystal Bead,snadaykhmernaturalaction Please click this video for more information and more video and You Can learn and good idea from Snaday Khmer Chanel This ...,Snaday Khmer Art
nvNde93w75g,2016-05-18T09:48:31Z,UCwN3ga5GMcJoGQf5-d6sEpQ,How to Iron Perler Beads Perfectly Tutorial,"This is a long requested video! This is how I iron my creations. PLEASE NOTE: your iron, your heat setting and the types of beads you use will affect how your ...",FiloPixie
sqMWwRRrxxA,2021-01-02T22:30:10Z,UCiDzTcIhR1pHftF83khH1uQ,My 2020 Perler Bead Crafts Collection!,"Looking back on 2020, I'm happy to see what I was able to create and share with all of you! I couldn't really make too many projects at the start of 2020 because I ...",QDCrafts
wkCPhaTmvpM,2021-06-16T13:09:33Z,UCk4Oqj6ZaAezWsSU76bzBLA,DIY Beaded Parrot Making | How to make Easy Beads parrot | Beads craft | Beaded work | Moti ka tota,beadedparrot#easyparrot#beadsparrot#beadscraft#beadedwork# @Homemade Creations - HMC Please watch full video. Press the Like Button. And subscribe ...,Homemade Creations - HMC - by Vandana Hegde
,2016-09-05T14:45:10Z,UCf9M1VLsBeOQUyMqBXuLSlw,Beads craft,,Jheannell Ramiterre
3PI3ktWzCb4,2021-01-07T09:30:26Z,UC-fyKAlxgpSKOEXfXmaWF3A,Beads pot/How to make Beads pot/Beads flower vase/Beads craft/ Beads work/Flower vase with beads....,Hiii friends... Today i am going to make a #flowervase...this is very easy to make... Please watch full video and support us.... This is the first part of video....next ...,Mijus world
F6auSWUZtqU,2016-09-26T02:01:04Z,UCAamGYSv7_GviMf7EaCEGHA,TUTORIAL - Beads Craft (Lotus Flower  蓮花),The lotus flower symbolizes rising from dirt and into purity and rebirth. The bloom is usually used for decoration and religious ceremonies. Watch the ...,ireneblchua
OuCV7lq9C8M,2020-12-01T02:31:40Z,UCYsfVerQtJWDKNcGylOhFRA,Beaded Ball Tutorial /  How to Make Beaded Bead / Beading Stitches,"Thank you for watching, hope you will like and share. Don't forget to like, subscribe and share for free tutorials. Thank you for your kindness , love and support.",5-minute Craft BEADWORK
CyQPqnBdV2k,2019-02-14T05:30:00Z,UCnobTPLeBxWHurWHq8jzsnA,12 BRILLIANT DIY PROJECTS WITH BEADS AND GLITTER,0:01 How save damaged eyeshadow 0:39 Glue lavender 0:58 Magic ball 1:41 Cute wrap ideas 3:07 bracelet 4:23 Organizers 5:06 Bracelet 5:32 Cute gift with ...,5-MINUTE MAGIC
48l7HCWmn5w,2019-10-19T13:44:46Z,UCEdfTj2EexFHhGOZb57Vzaw,BEADS CRAFT TUTORIAL FOR BEGINNERS - BASIC BEAD STICK WITH 10 STEPS,10 Easy Steps of bead making Step by Step Tutorial.,AtoZ Crafts and Cooking Tips
8aolRTaFc8I,2021-01-29T15:28:36Z,UCIcXros3PcSdZpZHfGj3ToA,Beads Craft/Beads Craft in tamil/Beaded table mat/Beading tutorials/Beading for beginners in tamil,BeadsCraft #BeadsCraftintamil #Beadingtutorials.,SandBowl
tOwW2562oEo,2017-04-06T08:31:03Z,UC2EYvdgX-yhzSLCL6NY6iIw,DIY Flower Vase : How To Make Beaded Flower Vase || Diy Beaded Craft Ideas,You Can Do This (DIY Projects) : DIY Flower Vase Making : How To Make Beaded Flower Vase || Diy Beaded Craft Ideas Materials Required For Making Flower ...,You can do this
ipX7Gk_Y9KQ,2017-03-07T17:35:38Z,UCelMeixAOTs2OQAAi9wU8-g,Make Your Own Ice Cream Shopkins - Beados  Water Beads Craft Playset - Toy Video,Let's make some Shopkins ice cream characters today using Beados! Place the beads on the tray and spray with water to create the sweetest Shokins ever!,CookieSwirlC
rOo9Cx8lJxQ,2021-03-30T14:33:18Z,UCP9QN7wJn84-aOrO4vCo3iw,ribbon crafts | satin ribbon | satin ribbon crafts | satin ribbon tree | beads craft | beads,ribbon crafts | satin ribbon | satin ribbon crafts | satin ribbon tree | beads craft | beads hi dear friends... hearty welcome to PoNnUs craft zone. in this video I am ...,PoNnUs Craft Zone
aPJvtrNepDY,2021-09-28T11:30:01Z,UCf4SQESO84TzzQc1XOEsfTg,Beads craft / அம்மாவின் கைவண்ணம்,,Sunface collections
aeFM0j9hncA,2021-06-28T13:17:03Z,UCQg86v2Zs4bIvKyWCgJdIWg,Bracelet making with seed beads #beads craft#Rainbow Creation ❤️,Bracelet making with seed beads #beads craft#Rainbow Creation ❤️ Materials required seed beads nylon thread needle jump rings lock scissor Thanks for ...,Rainbow Creation
qWSClLUynV4,2021-02-13T16:00:14Z,UCiDzTcIhR1pHftF83khH1uQ,Easy DIY Perler Bead Craft Ideas for Best Friends!,Excuse me while I celebrate singles awareness week :') Learn how to make some easy last minute DIY perler bead gifts for Valentine's Day! I made some ...,QDCrafts
WZ24Mbgfu_Q,2021-08-18T12:14:11Z,UC244A6hMft1b1T77loj5X2A,Craft tips | pompom beads craft ideas | flower making  | @states kitchen and crafts,craft tips#states kitchen and crafts flower vase making: https://youtu.be/Bf8PHcIFEn0.,states kitchen and crafts
jXSc9UkOH_M,2020-11-02T11:17:56Z,UCP9QN7wJn84-aOrO4vCo3iw,re-use of broomsticks | beads craft | easy crafts | DIY | home decor | crafts,re-use of broomsticks | beads craft | easy crafts | DIY | home decor | craft with broomticks hi dear friends.. hearty welcome to PoNnUs craft zone. In this video I am ...,PoNnUs Craft Zone
7laS1h_Qzzg,2020-06-13T02:16:01Z,UCMRJPxDMNZbpiTlg9sd8aww,Paper Beads Curtain DIY|Step by Step|Paper Craft Tutorial|How To Make Curtain with Paper|Art &amp; Craft,"Hi All :) In this tutorial, you're going to show you how to make an awesome curtain with Paper Beads... It's really fantastic and I'm pretty sure that you'll enjoy ...",Tota Crafts
,2019-09-15T17:45:00Z,UCsTMi5L8scv_pTRls5i6TmQ,Beads craft 2,,Ms_Fairy
ffxUaXc2Rl4,2017-02-17T11:00:01Z,UCSHBQTCb9NCIHyliT3xZ7Fg,Glam Bead Drink Coaster | Easy DIY Project | Another Coaster Friday | Craft Klatch | How To,Learn to create beaded coasters in this craft DIY tutorial. *This blog uses affiliate links. As an Amazon Associate I earn from qualifying purchases. You will need: ...,CraftKlatch
49G27GeTPS8,2020-09-30T18:15:42Z,UC_bUcF0Vda0W0K6Ek7ygorw,How to Make a Beaded Mask Holder,http://beadaholique.com/collections/seed-beads - In this video you will see how to use a simple strand of beads as a mask holder by adding a lobster clasp and ...,Beadaholique
RqmUA9ND8_E,2020-02-28T12:01:50Z,UCSvu1KprBJX13MSqSCmuSmg,Brilliant Craft Ideas From Beads. (2020),Hi Friends in this video I shared my creations to inspire you to make beading your hobby. You can also make beading your homebased business. These brilliant ...,MeRaquel
,2021-10-17T20:40:33Z,UCYHksaB5_QviOQ4iOwzDOAw,b e a d s,,Wilted Roses
Od9bhyY9k7Y,2020-01-11T03:00:10Z,UCiDzTcIhR1pHftF83khH1uQ,"178,000 Artkal Mini Beads Wall | IKEA Craft Room Makeover Part 2","Happy 2020! In this video, I assembled a colourful wall full of Artkal mini beads. Each container fits 1000 mini beads and I have 178 different colours in total on ...",QDCrafts
2WXb2UfkOZU,2019-09-16T15:06:13Z,UCU6ZW7vnn3Hl4lNbfUgYyAA,Most beautiful beaded craft ideas,Most beautiful beaded craft ideas.,Ideal Decor Ideas
59IGjnhGJ8s,2017-02-19T15:00:00Z,UC8B2IELLIDNH7ki7ke6tXow,DIY Seed Bead GAME BOY Color! // Bead Weaving // ¦ The Corner of Craft,I mean... You don't have to make your charm into a Game Boy Color! Just change the colours you use to make your charm and you can have whatever Game ...,The Corner of Craft
ECZrSTvmC9s,2021-02-20T19:22:46Z,UCi5qKpdhc16xlktQqW_NBfg,Crafting With Beads/DIY Beads Crafts/So you think you can craft challenge,soyouthingyoucancraftchallenge #craftingwithbeads #beadscraft #beadsshelf #beadsballerina In this video I am sharing a very cute beads craft idea about how ...,DIY SAVVY MOMMY
ACYIyZAhH-0,2017-10-31T03:01:23Z,UC6tIP64sTkjpbQN_WF7P4Hw,DIY Beads crafts,,Aarambha Creations
xRnlAF0DSCg,2017-01-05T06:50:58Z,UC2EYvdgX-yhzSLCL6NY6iIw,How To Make Crystal Beads Keychain || DIY Beaded Tie Keychain | Beads Craft Ideas,"How To Make Crystal Beads Keychain || DIY Beaded Tie Keychain | Beads Craft Ideas Materials Required For Making ""Tie Keychain"" : 1.Coloured Crystal ...",You can do this
dZaGaTxeINc,2020-06-07T14:00:10Z,UCyqV5NqaH8UwREiH7HsRn9w,Tassel Bead Charms Craft With Me,I've had a few requests to show you how I make my tassel bead charms. I hope you like this process video :) xoxo ______ ♡ Find me on Instagram ...,Cheryl G
MWbOb3SrZD0,2021-05-14T06:11:26Z,UCQg86v2Zs4bIvKyWCgJdIWg,How to make butterfly with beads/beaded butterfly/beads work/beads craft/Rainbow creation ❤️,How to make butterfly with beads/beaded butterfly/beads work/beads craft/Rainbow creation ❤️ Thanks for watching.,Rainbow Creation
6W_e7nt9SV4,2021-02-26T14:17:05Z,UC6J90osojs3fS8cJCKbsnpw,How to make flowers from foam beads | Easy Foam beads craft idea | Foam beads DIY,"A step by step demonstration of an easy Foam beads craft idea, that brings elegance to your home in few simple steps. Making flowers from foam beads is super ...",Risi Kids Play
2_hhLv9kki8,2021-01-25T10:45:11Z,UCoYv0jqzmnc8MO-EiVYuEmg,Another Set of Beads craft Daimond Painting Part 1,LENNYMANS #OFWHONGKONG #BeadsCraft #LutosDesign Join this channel to get access to perks: ...,Lenny Mans
dLNHQx_LFOE,2020-02-15T15:55:49Z,UCugQOboCllAwHi81rVk9Sqw,Beautiful Beads Crafts Design ideas,,Super Idea